{
  "schema_version": 1,
  "manifest_version": 1,
  "adapters": ["aider", "claude", "codex", "copilot", "cursor", "gemini", "pi"],
  "components": [
    {"id": "core", "default": true, "adapters": []},
    {"id": "claude", "default": false, "adapters": ["claude"]},
    {"id": "cursor", "default": false, "adapters": ["cursor"]},
    {"id": "copilot", "default": false, "adapters": ["copilot"]},
    {"id": "gemini", "default": false, "adapters": ["gemini"]},
    {"id": "aider", "default": false, "adapters": ["aider"]},
    {"id": "pi", "default": false, "adapters": ["pi"]},
    {"id": "portable-skills", "default": false, "adapters": ["aider", "codex", "copilot", "cursor", "gemini", "pi"]},
    {"id": "legacy-workflow-files", "default": false, "adapters": []}
  ],
  "assets": [
    {"asset_id": "root-agents", "component": "core", "source": "templates/AGENTS.md", "destination": "AGENTS.md", "ownership": "template-managed", "update_strategy": "three-way", "remove_strategy": "preserve", "mode": "0644"},
    {"asset_id": "workflow-config", "component": "core", "source": "templates/.workflow/config.yml", "destination": ".workflow/config.yml", "ownership": "project-seed", "update_strategy": "typed-migration", "remove_strategy": "preserve", "mode": "0644"},
    {"asset_id": "workflow-project", "component": "core", "source": "templates/.workflow/project.yml", "destination": ".workflow/project.yml", "ownership": "project-seed", "update_strategy": "typed-migration", "remove_strategy": "preserve", "mode": "0644"},
    {"asset_id": "legacy-stack", "component": "legacy-workflow-files", "source": "templates/.workflow/stack.yml", "destination": ".workflow/stack.yml", "ownership": "project-seed", "update_strategy": "typed-migration", "remove_strategy": "archive", "mode": "0644"},
    {"asset_id": "legacy-architecture", "component": "legacy-workflow-files", "source": "templates/.workflow/architecture.yml", "destination": ".workflow/architecture.yml", "ownership": "project-seed", "update_strategy": "typed-migration", "remove_strategy": "archive", "mode": "0644"},
    {"asset_id": "legacy-conventions", "component": "legacy-workflow-files", "source": "templates/.workflow/conventions.yml", "destination": ".workflow/conventions.yml", "ownership": "project-seed", "update_strategy": "typed-migration", "remove_strategy": "archive", "mode": "0644"},
    {"asset_id": "legacy-workflow", "component": "core", "source": "templates/.workflow/workflow.yml", "destination": ".workflow/workflow.yml", "ownership": "project-seed", "update_strategy": "typed-migration", "remove_strategy": "preserve", "mode": "0644"},
    {"asset_id": "legacy-presets", "component": "legacy-workflow-files", "source": "templates/.workflow/presets.yml", "destination": ".workflow/presets.yml", "ownership": "project-seed", "update_strategy": "typed-migration", "remove_strategy": "archive", "mode": "0644"},
    {"asset_id": "legacy-status", "component": "core", "source": "templates/.workflow/status.yml", "destination": ".workflow/status.yml", "ownership": "project-seed", "update_strategy": "typed-migration", "remove_strategy": "preserve", "mode": "0644"},
    {"asset_id": "workflow-bootstrap", "component": "core", "source": "templates/.workflow/bootstrap.md", "destination": ".workflow/bootstrap.md", "ownership": "template-managed", "update_strategy": "three-way", "remove_strategy": "remove-if-unmodified", "mode": "0644"},
    {"asset_id": "workflow-history-format", "component": "core", "source": "templates/.workflow/history-format.md", "destination": ".workflow/history-format.md", "ownership": "template-managed", "update_strategy": "three-way", "remove_strategy": "remove-if-unmodified", "mode": "0644"},
    {"asset_id": "workflow-readme", "component": "core", "source": "templates/.workflow/README.md", "destination": ".workflow/README.md", "ownership": "template-managed", "update_strategy": "three-way", "remove_strategy": "remove-if-unmodified", "mode": "0644"},
    {"asset_id": "workflow-history-directory", "component": "core", "source": "templates/.workflow/history/.gitkeep", "destination": ".workflow/history/.gitkeep", "ownership": "local-seed", "update_strategy": "create-only", "remove_strategy": "preserve", "mode": "0644"},
    {"asset_id": "project-gitignore", "component": "core", "source": "templates/gitignore.snippet", "destination": ".gitignore", "ownership": "shared-merge", "update_strategy": "structured-merge", "remove_strategy": "remove-contribution", "mode": "0644"},
    {"asset_id": "generated-lock", "component": "core", "source": null, "destination": ".workflow/status.lock.json", "ownership": "generated", "update_strategy": "regenerate", "remove_strategy": "remove-if-generated", "mode": "0600"},
    {"asset_id": "install-state", "component": "core", "source": null, "destination": ".workflow/install-state.json", "ownership": "generated", "update_strategy": "regenerate", "remove_strategy": "preserve", "mode": "0600"},
    {"asset_id": "claude-instructions", "component": "claude", "source": "templates/adapters/claude/CLAUDE.md", "destination": "CLAUDE.md", "ownership": "template-managed", "update_strategy": "three-way", "remove_strategy": "remove-if-unmodified", "mode": "0644"},
    {"asset_id": "claude-command-analyze", "component": "claude", "source": "templates/prompts/analyze.md", "destination": ".claude/commands/analyze.md", "ownership": "template-managed", "update_strategy": "three-way", "remove_strategy": "remove-if-unmodified", "mode": "0644"},
    {"asset_id": "claude-command-init", "component": "claude", "source": "templates/prompts/init-workflow.md", "destination": ".claude/commands/init-workflow.md", "ownership": "template-managed", "update_strategy": "three-way", "remove_strategy": "remove-if-unmodified", "mode": "0644"},
    {"asset_id": "claude-command-plan", "component": "claude", "source": "templates/prompts/plan.md", "destination": ".claude/commands/plan.md", "ownership": "template-managed", "update_strategy": "three-way", "remove_strategy": "remove-if-unmodified", "mode": "0644"},
    {"asset_id": "claude-skill-workflow", "component": "claude", "source": "templates/skills/workflow/SKILL.md", "destination": ".claude/skills/workflow/SKILL.md", "ownership": "template-managed", "update_strategy": "three-way", "remove_strategy": "remove-if-unmodified", "mode": "0644"},
    {"asset_id": "cursor-instructions", "component": "cursor", "source": "templates/adapters/cursor/.cursor/rules/workflow.mdc", "destination": ".cursor/rules/workflow.mdc", "ownership": "template-managed", "update_strategy": "three-way", "remove_strategy": "remove-if-unmodified", "mode": "0644"},
    {"asset_id": "copilot-instructions", "component": "copilot", "source": "templates/adapters/copilot/.github/copilot-instructions.md", "destination": ".github/copilot-instructions.md", "ownership": "template-managed", "update_strategy": "three-way", "remove_strategy": "remove-if-unmodified", "mode": "0644"},
    {"asset_id": "gemini-instructions", "component": "gemini", "source": "templates/adapters/gemini/GEMINI.md", "destination": "GEMINI.md", "ownership": "template-managed", "update_strategy": "three-way", "remove_strategy": "remove-if-unmodified", "mode": "0644"},
    {"asset_id": "aider-config", "component": "aider", "source": "templates/adapters/aider/.aider.conf.yml", "destination": ".aider.conf.yml", "ownership": "template-managed", "update_strategy": "three-way", "remove_strategy": "remove-if-unmodified", "mode": "0644"},
    {"asset_id": "pi-prompt-analyze", "component": "pi", "source": "templates/prompts/analyze.md", "destination": ".pi/prompts/analyze.md", "ownership": "template-managed", "update_strategy": "three-way", "remove_strategy": "remove-if-unmodified", "mode": "0644"},
    {"asset_id": "pi-prompt-init", "component": "pi", "source": "templates/prompts/init-workflow.md", "destination": ".pi/prompts/init-workflow.md", "ownership": "template-managed", "update_strategy": "three-way", "remove_strategy": "remove-if-unmodified", "mode": "0644"},
    {"asset_id": "pi-prompt-plan", "component": "pi", "source": "templates/prompts/plan.md", "destination": ".pi/prompts/plan.md", "ownership": "template-managed", "update_strategy": "three-way", "remove_strategy": "remove-if-unmodified", "mode": "0644"},
    {"asset_id": "portable-skill-workflow", "component": "portable-skills", "source": "templates/skills/workflow/SKILL.md", "destination": ".agents/skills/workflow/SKILL.md", "ownership": "template-managed", "update_strategy": "three-way", "remove_strategy": "remove-if-unmodified", "mode": "0644"}
  ]
}
